Title,Link,Cluster,Event_Severity,Event_Label,Published_utc
"Immigration Judge Says Rumeysa Ozturk, a Tufts Student, Cannot Be Deported",https://www.nytimes.com/2026/02/10/us/immigration-judge-tufts-student-rumeysa-ozturk.html,-1,,,2026-02-10 17:20:28+00:00
NIH Support for Early Stage Investigators in FYs 2024 and 2025,https://grants.nih.gov/news-events/nih-extramural-nexus-news/2026/02/nih-support-for-early-stage-investigators-in-fys-2024-and-2025,-1,,,2026-02-10 18:11:24+00:00
Epstein Used Cash to Wield His Influence at Columbia and N.Y.U.,https://www.nytimes.com/2026/02/10/nyregion/epstein-columbia-nyu-donations-admission-young-women.html,-1,,,2026-02-10 19:15:44+00:00
DHS Funding Deadline Approaches With No Deal Yet on Immigration,https://www.bloomberg.com/news/newsletters/2026-02-10/dhs-funding-deadline-approaches-with-no-deal-yet-on-immigration,-1,,,2026-02-10 21:33:57+00:00
DOJ signals crackdown on synagogue protesters using abortion clinic statute,https://www.foxnews.com/politics/doj-signals-crackdown-synagogue-protesters-using-abortion-clinic-statute,-1,,,2026-02-10 23:09:41+00:00
Game Night,https://www.centenary.edu/events/details/game-night/2026-02-11/,-1,,,2026-02-11 06:32:00+00:00
DHS faces weekend shutdown with ICE talks inching forward,https://thehill.com/homenews/senate/5732420-senate-democrats-ice-reform-demands/,-1,,,2026-02-11 11:00:00+00:00
"Federal Debt to Hit Record Levels, Budget Office Warns",https://www.nytimes.com/2026/02/11/business/federal-debt-record-levels-budget-office.html,-1,,,2026-02-11 18:45:03+00:00
"Federal deficits and debt will worsen over next decade, Congressional Budget Office finds",https://www.pbs.org/newshour/politics/federal-deficits-and-debt-will-worsen-over-next-decade-congressional-budget-office-finds,-1,,,2026-02-11 18:56:26+00:00
Colleges Cut Ad Spending by More Than Half in Last Decade,https://www.insidehighered.com/news/quick-takes/2026/02/12/colleges-cut-ad-spending-more-half-last-decade,-1,,,2026-02-12 00:00:00+00:00
"Iowa Lakes Community College baseball team bus crashes, killing 1 person and injuring 32",https://abcnews.go.com/US/wireStory/iowa-lakes-community-college-baseball-team-bus-crashes-130085747,-1,,,2026-02-12 03:25:21+00:00
UW Carbone Cancer Center opens registration for 25th annual Bowlin' for Colons fundraiser,https://www.channel3000.com/news/uw-carbone-cancer-center-opens-registration-for-25th-annual-bowlin-for-colons-fundraiser/article_4c097f94-e07e-4a74-ba08-41b7da5b11e3.html,-1,,,2026-02-12 06:32:00+00:00
$425K NIFA Grant Supports Statewide Weather Station Network,https://news.uark.edu/articles/80756/-425k-nifa-grant-supports-statewide-weather-station-network,-1,,,2026-02-12 06:32:00+00:00
EPA repeals landmark finding that climate pollution is harmful,https://www.politico.com/news/2026/02/12/epa-repeals-endangerment-finding-vehicle-climate-standards-00732274,-1,,,2026-02-12 13:44:54+00:00
Democrats reject White House counterproposal to keep DHS operating,https://thehill.com/homenews/senate/5735322-democrats-reject-white-house-counterproposal-dhs/,-1,,,2026-02-12 15:50:54+00:00
Ohio State Professor Luke Perez Put on Leave After Tackling Filmmaker Over Epstein,https://www.nytimes.com/2026/02/12/us/ohio-state-luke-perez-gordon-gee.html,-1,,,2026-02-12 17:24:43+00:00
Planning an NIH Application involving Basic Experimental Studies with Humans (BESH)?,https://grants.nih.gov/news-events/nih-extramural-nexus-news/2026/02/planning-an-nih-application-involving-basic-experimental-studies-with-humans-besh,-1,,,2026-02-12 18:00:40+00:00
Gov. Landry names new LSU Board of Supervisors chairman,https://lailluminator.com/briefs/gov-landry-names-new-lsu-board-of-supervisors-chairman/,-1,,,2026-02-12 19:20:39+00:00
Lawmakers resign themselves to lengthy DHS shutdown,https://www.politico.com/news/2026/02/12/congress-shutdown-dhs-ice-00779881,-1,,,2026-02-12 20:46:52+00:00
"Trump Revokes Key EPA Finding, AI Concerns Resurface, More",https://www.bloomberg.com/news/audio/2026-02-12/trump-revokes-key-epa-finding-ai-concerns-resurface-more,-1,,,2026-02-12 23:44:47+00:00
Partial Federal Shutdown Shrinks Congressional Presence in Munich,https://www.nytimes.com/2026/02/12/us/politics/munich-security-conference-lawmakers.html,-1,,,2026-02-13 01:30:58+00:00
"School of Art Selected as Participant for National Craft Initiative, Will Host Visiting Artist Carla Edwards",https://news.uark.edu/articles/80757/school-of-art-selected-as-participant-for-national-craft-initiative-will-host-visiting-artist-carla-edwards,-1,,,2026-02-13 06:32:00+00:00
The only constant is change,https://www.ncspin.com:443/the-only-constant-is-change,-1,,,2026-02-13 06:32:00+00:00
DOJ Sues Harvard Over Access to Data on Race in Admissions,https://www.bloomberg.com/news/articles/2026-02-13/doj-sues-harvard-for-withholding-records-on-race-in-admissions,-1,,,2026-02-13 14:59:48+00:00
Student-loan forgiveness emails are going out to a new batch of borrowers,https://www.businessinsider.com/student-loan-forgiveness-idr-debt-relief-taxes-2026-2,-1,,,2026-02-13 16:14:10+00:00
UW-Madison requiring students to disclose measles vaccination status,https://thehill.com/homenews/education/5737395-uw-madison-measles-vaccination-status/,-1,,,2026-02-13 16:59:23+00:00
Krewe of UNO brings Mardi Gras cheer to campus amid tumultuous times,https://lailluminator.com/2026/02/13/krewe-of-uno/,-1,,,2026-02-13 18:00:47+00:00
Justice Department Sues Harvard for Admissions Records,https://www.nytimes.com/2026/02/13/us/politics/harvard-lawsuit-admissions-doj-trump.html,-1,,,2026-02-13 18:52:35+00:00
Congress Leaves DC as DHS Shuts Down,https://www.nytimes.com/2026/02/13/us/politics/congress-jets-off-shutdown.html,-1,,,2026-02-13 20:01:32+00:00
Trump Administration Revokes Deportation Protections for Yemenis,https://www.nytimes.com/2026/02/13/us/politics/trump-administration-revokes-deportation-protections-for-yemenis.html,-1,,,2026-02-13 20:08:54+00:00
"Department of Homeland Security enters shutdown, amid dispute over funding",https://lailluminator.com/2026/02/13/repub/homeland-security-shutdown-2/,-1,,,2026-02-13 20:59:46+00:00
Trump at Another Shutdown Standoff With Democrats,https://www.bloomberg.com/news/newsletters/2026-02-13/trump-at-another-shutdown-standoff-with-democrats,-1,,,2026-02-13 21:31:57+00:00
"2 Dead, One Wounded in Shooting at South Carolina State University",https://www.nytimes.com/2026/02/13/us/shooting-south-carolina-state.html,-1,,,2026-02-13 22:23:38+00:00
White House Orders Homeland Security Shutdown as Funding Lapses,https://www.bloomberg.com/news/articles/2026-02-13/white-house-orders-homeland-security-shutdown-as-funding-lapses,-1,,,2026-02-13 23:10:52+00:00
Measles Outbreak Hits Ave Maria University in Florida,https://www.nytimes.com/2026/02/13/well/measles-florida-ave-maria-university.html,-1,,,2026-02-13 23:26:58+00:00
News Wrap: Economic data shows inflation easing at start of year,https://www.pbs.org/newshour/show/news-wrap-economic-data-shows-inflation-easing-at-start-of-year,-1,,,2026-02-13 23:45:26+00:00
"Partial Shutdown at Midnight, Losing Streak for Amazon, More",https://www.bloomberg.com/news/audio/2026-02-14/partial-shutdown-at-midnight-losing-streak-for-amazon-more,-1,,,2026-02-14 00:03:53+00:00
Jury Deadlocked in Trial of Pro-Palestinian Demonstrators at Stanford,https://www.nytimes.com/2026/02/13/us/stanford-students-protests-trial.html,-1,,,2026-02-14 00:10:50+00:00
US Homeland Security Department Shuts Down Amid ICE Raid Impasse,https://www.bloomberg.com/news/articles/2026-02-14/dhs-government-shutdown-starts-amid-ice-raid-impasse,-1,,,2026-02-14 05:01:49+00:00
"Partial Shutdown Begins, Goldman CEO Rattles Bank, More",https://www.bloomberg.com/news/audio/2026-02-14/partial-shutdown-begins-goldman-ceo-rattles-bank-more,-1,,,2026-02-14 05:02:40+00:00
"Department of Homeland Security Shuts Down, Though Essential Work Continues",https://www.nytimes.com/2026/02/13/us/politics/dhs-shutdown-funding.html,-1,,,2026-02-14 05:48:49+00:00
Kaitlyn Smitten - The Arizona State Press,https://www.statepress.com/staff/kaitlyn_smitten,-1,,,2026-02-14 06:17:00+00:00
"Rubio Warns European Leaders, Funding Fight Shuts Down DHS, More",https://www.bloomberg.com/news/audio/2026-02-14/rubio-warns-european-leaders-funding-fight-shuts-down-dhs-more,-1,,,2026-02-14 11:37:01+00:00
Epstein files: A list of people facing consequences over the DOJ's release,https://www.businessinsider.com/epstein-files-consequences-resignations-brad-karp-kathy-ruemmler-wasserman,-1,,,2026-02-14 17:34:48+00:00
"Government Shutdown Hits DHS, TSA, Homan Pulls ICE From MN, More",https://www.bloomberg.com/news/audio/2026-02-15/government-shutdown-hits-dhs-tsa-homan-pulls-ice-from-mn-more,-1,,,2026-02-15 17:48:14+00:00
"Campus Radicals Newsletter: Antifa-linked group tells students to mobilize, college students fake disabilities",https://www.foxnews.com/politics/campus-radicals-newsletter-antifa-linked-group-tells-students-to-mobilize-college-students-fake-disabilities,-1,,,2026-02-15 18:12:15+00:00
"Here's how the DHS shutdown is impacting air travel, TSA",https://thehill.com/policy/transportation/5739852-tsa-shutdown-impacts-air-travel/,-1,,,2026-02-16 00:26:07+00:00
omg we ate a guy! | WDAV 89.9,https://wdav.org/event/omg-we-ate-a-guy/,-1,,,2026-02-16 06:31:00+00:00
Largest measles outbreak in recent history reported on southwestern Florida college campus,https://www.foxnews.com/health/largest-measles-outbreak-recent-history-reported-southwestern-college-campus,-1,,,2026-02-16 19:10:28+00:00
How biodegradable beads may help make Mardi Gras more sustainable,https://www.pbs.org/newshour/nation/how-biodegradable-beads-may-help-make-mardi-gras-more-sustainable,-1,,,2026-02-16 20:20:35+00:00
Fondling reported outside Boot Bar and Grill • The Tulane Hullabaloo,https://tulanehullabaloo.com/73218/news/fondling-reported-outside-boot-bar-and-grill/,-1,,,2026-02-17 00:00:00+00:00
Trump Sought Vast Budget Cuts. Congress Granted Few.,https://www.nytimes.com/2026/02/17/us/politics/trump-congress-budget-cuts.html,-1,,,2026-02-17 10:03:00+00:00
HBCUs do more than offer Black youths a pathway to opportunity and success,https://lailluminator.com/2026/02/17/hbcu-criminal-justice/,-1,,,2026-02-17 11:00:45+00:00
Hegseth launches culture war against elite universities,https://thehill.com/policy/defense/5742833-hegseth-targets-universities-culture-war/,-1,,,2026-02-18 11:00:00+00:00
Judge Blocks Deportation of Columbia Protester Mohsen Mahdawi,https://www.nytimes.com/2026/02/17/nyregion/columbia-mohsen-mahdawi-deportation.html,-1,,,2026-02-18 19:16:14+00:00
A leaked Pentagon list flagging dozens of universities as risks blindsided schools and military students alike,https://www.businessinsider.com/pentagon-reviews-schools-students-universities-uncertainty-2026-2,-1,,,2026-02-18 22:12:42+00:00
"Norman C. Francis, New Orleans civil rights icon who fostered Xavier, dies at 94",https://lailluminator.com/2026/02/18/norman-francis/,-1,,,2026-02-18 23:13:48+00:00
Bloomberg Law:Suit Over Erasing History & Harvard Sued (Podcast),https://www.bloomberg.com/news/audio/2026-02-18/bloomberg-law-suit-over-erasing-history-harvard-sued-podcast,-1,,,2026-02-18 23:51:37+00:00
"Rep. Glenn Ivey (D), Maryland on Partial Shutdown",https://www.bloomberg.com/news/videos/2026-02-19/rep-glenn-ivey-d-maryland-on-partial-shutdown-video,-1,,,2026-02-19 00:08:15+00:00
Partial Government Shutdown Drags On As Talks Stall | Balance of Power: Late Edition 2/18/2026,https://www.bloomberg.com/news/videos/2026-02-19/balance-of-power-late-edition-2-18-2026-video,-1,,,2026-02-19 00:12:45+00:00
Vigil honors Temple Police Sgt. Christopher Fitzgerald 3 years after killing,https://6abc.com/post/vigil-honors-temple-police-sgt-christopher-fitzgerald-3-years-killing/18618423/,-1,,,2026-02-19 06:31:00+00:00
The Princetonian,https://www.dailyprincetonian.com/staff/emily-murphy,-1,,,2026-02-19 06:31:00+00:00
Campus vaccine strategies put to test by rising measles cases,https://thehill.com/homenews/education/5743877-measles-outbreak-cdc-hhs-rfk-jr-vaccine-policy/,-1,,,2026-02-19 11:00:00+00:00
"Change to nightly eating habits may help protect your heart, study suggests",https://www.foxnews.com/health/change-nightly-eating-habits-may-help-protect-your-heart-study-suggests,-1,,,2026-02-19 12:00:08+00:00
LSU scientist invents foam to fight growing threat of microplastics,https://lailluminator.com/2026/02/19/lsu-scientist-invents-foam-to-fight-growing-threat-of-microplastics/,-1,,,2026-02-19 16:04:37+00:00
Stay Informed About NIH Grants Policy and Processes,https://grants.nih.gov/news-events/nih-extramural-nexus-news/2026/02/stay-informed-about-nih-grants-policy-and-processes,-1,,,2026-02-19 16:39:43+00:00
Learn How Much You Could Receive for a Loan Repayment Award,https://grants.nih.gov/news-events/nih-extramural-nexus-news/2026/02/learn-how-much-you-could-receive-for-a-loan-repayment-award,-1,,,2026-02-19 16:55:54+00:00
"Ricketts backs his wife, a Democrat, in Nebraska election",https://thehill.com/homenews/campaign/5745468-pete-ricketts-endorses-wife-susanne/,-1,,,2026-02-19 17:41:26+00:00
Refugees Without Green Cards Could Be Arrested Under New Trump Policy,https://www.nytimes.com/2026/02/19/us/politics/refugees-green-cards.html,-1,,,2026-02-19 19:35:00+00:00
"On an Ambitious Antarctic Quest, One Nation Is on the Sidelines",https://www.nytimes.com/2026/02/19/climate/antarctica-science-funding.html,-1,,,2026-02-19 20:11:19+00:00
The Pentagon marked 33 universities as 'moderate' or 'high' risk. Here are the schools on the leaked list.,https://www.businessinsider.com/list-schools-pentagon-marked-as-risks-internal-email-2026-2,-1,,,2026-02-19 20:16:02+00:00
UL Lafayette down to 3 semifinalists for president,https://lailluminator.com/2026/02/19/ul-lafayette-down-to-3-semifinalists-for-president/,-1,,,2026-02-19 21:56:04+00:00
"US GDP Grows 1.4%, Missing Forecasts on Shutdown, Trade",https://www.bloomberg.com/news/articles/2026-02-20/us-gdp-rose-at-slower-than-forecast-pace-of-1-4-last-quarter,-1,,,2026-02-20 13:33:48+00:00
Why SCOTUS' rejection of Biden's student-loan forgiveness plays a big role in its Trump tariff decision,https://www.businessinsider.com/supreme-court-overturn-trump-tariffs-biden-student-loan-forgiveness-2026-2,-1,,,2026-02-20 16:28:10+00:00
U.S. Economy Grew Modestly at End of 2025,https://www.nytimes.com/2026/02/20/business/economy/us-economy-gdp.html,-1,,,2026-02-20 17:37:49+00:00
"U.S. economic growth slowed sharply at end of 2025, dragging down the year",https://www.washingtonpost.com/business/2026/02/20/gdp-2025-economy-tariffs-trade/,-1,,,2026-02-20 18:42:25+00:00
"Q&A: Jason French, LSU chief of staff on its new structure, new hires and new campus",https://lailluminator.com/2026/02/20/qa-jason-french-lsu-chief-of-staff-on-its-new-structure-new-hires-and-new-campus/,-1,,,2026-02-20 19:46:50+00:00
"SCOTUS Strikes Down Trump Tariff, Trump Announces New Tariff",https://www.bloomberg.com/news/audio/2026-02-20/scotus-strikes-down-trump-tariff-trump-announces-new-tariff,-1,,,2026-02-20 22:23:06+00:00
What's next for consumers and the economy after the Supreme Court's tariff ruling,https://www.pbs.org/newshour/show/whats-next-for-consumers-and-the-economy-after-the-supreme-courts-tariff-ruling,-1,,,2026-02-20 23:50:25+00:00
"Trump Signs 10% Global Tariff in Bid to Salvage Trade Plan, More",https://www.bloomberg.com/news/audio/2026-02-21/trump-signs-10-global-tariff-in-bid-to-salvage-trade-plan-more,-1,,,2026-02-21 00:50:56+00:00
"Campus Radicals Newsletter: Teacher who lost job over 2-word post breaks silence, Chicago 'racial segregation'",https://www.foxnews.com/politics/campus-radical-newsletter-teacher-who-lost-job-over-2-word-post-breaks-silence-chicago-racial-segregation,-1,,,2026-02-21 01:16:49+00:00
"Trump Slams SCOTUS Tariff Ruling, Imposes 10% Global Duty, More",https://www.bloomberg.com/news/audio/2026-02-21/trump-slams-scotus-tariff-ruling-imposes-10-global-duty-more,-1,,,2026-02-21 02:39:44+00:00
He Researched Dishonesty. He Got Friendly With Jeffrey Epstein.,https://www.nytimes.com/2026/02/21/business/jeffrey-epstein-dan-ariely-dishonesty.html,-1,,,2026-02-21 13:25:20+00:00
"Trump Announcing on Social Media a Tariff Increase to 15%, More",https://www.bloomberg.com/news/audio/2026-02-21/trump-announcing-on-social-media-a-tariff-increase-to-15-more,-1,,,2026-02-21 16:33:12+00:00
"Norman Francis, Who Led Xavier University Into a New Era, Dies at 94",https://www.nytimes.com/2026/02/22/us/norman-francis-dead.html,-1,,,2026-02-22 21:38:01+00:00
Blood test could predict when Alzheimer's symptoms will begin,https://thehill.com/policy/healthcare/5750746-alzheimer-ptau217-blood-marker/,-1,,,2026-02-23 16:59:03+00:00
NIH Institute and Center Director Perspectives on Implementing the NIH Unified Funding Strategy,https://grants.nih.gov/news-events/nih-extramural-nexus-news/2026/02/nih-institute-and-center-director-perspectives-on-implementing-the-nih-unified-funding-strategy,-1,,,2026-02-23 17:49:35+00:00
Landry calls on Trump administration to expand its DEI investigation into Louisiana universities,https://lailluminator.com/2026/02/23/gov-landry-calls-on-trump-administration-to-expand-its-dei-investigation-into-louisiana-universities/,-1,,,2026-02-23 22:04:59+00:00
Stephen Miller's staying power: From the Politics Desk,https://www.nbcnews.com/politics/politics-news/stephen-millers-staying-power-politics-desk-rcna260328,-1,,,2026-02-23 22:31:58+00:00
"Trump Education Department outsources more responsibilities, continuing proposed wind-down",https://lailluminator.com/2026/02/23/repub/trump-education-department-2/,-1,,,2026-02-23 23:44:50+00:00
DOJ Sues UCLA Claiming It Ignored Antisemitism Toward Staff,https://www.bloomberg.com/news/articles/2026-02-24/trump-officials-accuse-ucla-in-lawsuit-of-ignoring-antisemitism,-1,,,2026-02-24 21:12:03+00:00
D.O.J. Sues U.C.L.A. After It Refused to Pay $1 Billion Fine,https://www.nytimes.com/2026/02/24/us/justice-department-ucla-lawsuit.html,-1,,,2026-02-24 22:27:21+00:00
"Justice Department sues UCLA, alleging school failed to protect Jewish employees from hostility",https://www.pbs.org/newshour/education/justice-department-sues-ucla-alleging-school-failed-to-protect-jewish-employees-from-hostility,-1,,,2026-02-25 01:22:59+00:00
Trump Says Democrats Cut Off All Funding to the Dept. of Homeland Security,https://www.bloomberg.com/news/videos/2026-02-25/digi-trump-on-dhs-restore-funding,-1,,,2026-02-25 03:28:13+00:00
"The longest State of the Union addresses in recent history, ranked",https://www.businessinsider.com/state-of-the-union-address-longest-record,-1,,,2026-02-25 04:40:31+00:00
"Combination nasal spray vaccine could protect against COVID, flu and pneumonia at once",https://www.foxnews.com/health/combination-nasal-spray-vaccine-could-protect-against-covid-flu-pneumonia-once,-1,,,2026-02-25 12:00:15+00:00
Larry Summers is leaving his Harvard teaching job following the release of personal emails with Jeffrey Epstein,https://www.businessinsider.com/larry-summers-retiring-harvard-university-following-epstein-emails-2026-2,-1,,,2026-02-25 17:58:41+00:00
Highlighted Topics Spotlight: Cancer Research,https://grants.nih.gov/news-events/nih-extramural-nexus-news/2026/02/highlighted-topics-spotlight-cancer-research,-1,,,2026-02-25 18:14:25+00:00
Larry Summers Will Resign From Harvard After Jeffrey Epstein Revelations,https://www.nytimes.com/2026/02/25/us/larry-summers-resignation-harvard-epstein.html,-1,,,2026-02-25 20:16:35+00:00
What to know about the risks of carbon monoxide poisoning after college student's death,https://www.pbs.org/newshour/health/what-to-know-about-the-risks-of-carbon-monoxide-poisoning-after-college-students-death,-1,,,2026-02-25 22:06:26+00:00
"Larry Summers will resign from teaching at Harvard during review of Epstein ties, university says",https://www.pbs.org/newshour/nation/larry-summers-will-resign-from-teaching-at-harvard-during-review-of-epstein-ties-university-says,-1,,,2026-02-25 23:03:29+00:00
Some 80-year-olds still have razor-sharp brains — and now scientists know why,https://www.foxnews.com/health/some-80-year-olds-still-have-razor-sharp-brains-now-scientists-know-why,-1,,,2026-02-26 12:00:29+00:00
Trump tells NYC Mayor Zohran Mamdani Columbia student detained by ICE will be released,https://www.foxnews.com/politics/trump-tells-nyc-mayor-zohran-mamdani-columbia-student-detained-ice-released,-1,,,2026-02-26 18:34:52+00:00
"If you have federal student loan debt, here's what experts want you to know",https://www.pbs.org/newshour/nation/if-you-have-federal-student-loan-debt-heres-what-experts-want-you-to-know,-1,,,2026-02-26 19:48:59+00:00
Kansas law invalidates transgender driver's licenses and birth certificates,https://www.foxnews.com/politics/kansas-law-invalidates-transgender-residents-drivers-licenses-birth-certificates,-1,,,2026-02-26 22:34:14+00:00
Leading Diversity Officers in Turbulent Times,https://www.insidehighered.com/news/diversity/2026/02/27/leading-diversity-officers-turbulent-times,-1,,,2026-02-27 00:00:00+00:00
Columbia Student Is Released From ICE After Mamdani-Trump Meeting,https://www.nytimes.com/2026/02/26/nyregion/columbia-university-ice-student.html,-1,,,2026-02-27 01:30:08+00:00
ICE releases Columbia student after Mamdani asks Trump for help,https://www.washingtonpost.com/education/2026/02/26/columbia-university-student-ice-arrest/,-1,,,2026-02-27 02:26:39+00:00
"Mamdani Meets Again With Trump, Emerging With Two Unexpected Victories",https://www.nytimes.com/2026/02/26/nyregion/mamdani-trump-meeting.html,-1,,,2026-02-27 02:53:52+00:00
Make a Perfect Pair with NIH Matchmaker,https://grants.nih.gov/news-events/nih-extramural-nexus-news/2026/02/make-a-perfect-pair-with-nih-matchmaker,-1,,,2026-02-27 16:18:48+00:00
"Education Department data shows foreign contracts, gifts to US colleges topped $5B in 2025",https://lailluminator.com/2026/02/27/repub/education-department-data-shows-foreign-contracts-gifts-to-us-colleges-topped-5b-in-2025/,-1,,,2026-02-27 16:42:25+00:00
EEOC Says Agencies Can Restrict Bathroom Use by Sex,https://www.nytimes.com/2026/02/27/us/politics/eeoc-gender-bathrooms-transgender.html,-1,,,2026-02-27 19:10:56+00:00
Southern University awards posthumous degree to student victim of hazing,https://lailluminator.com/2026/02/27/southern-university-awards-posthumous-degree-to-student-victim-of-hazing/,-1,,,2026-02-27 20:09:37+00:00
"LSU will once again require ACT scores for student applications, but no minimum",https://lailluminator.com/2026/02/27/lsu-will-once-again-require-act-scores-for-student-applications-but-no-minimum/,-1,,,2026-02-27 20:16:53+00:00
Ramesh Kolluru chosen as UL Lafayette president,https://lailluminator.com/2026/02/27/ramesh-kolluru-chosen-as-ul-lafayette-president/,-1,,,2026-02-27 20:24:59+00:00
What Are ICE Agents Allowed to Do on College Campuses?,https://www.nytimes.com/2026/02/27/nyregion/immigration-agents-college-campus-columbia.html,-1,,,2026-02-27 23:37:17+00:00
2 Make a Difference: 'I Am Somebody' documentary covers Southern University School of Nursing,https://www.wbrz.com/news/2-make-a-difference-i-am-somebody-documentary-covers-southern-university-school-of-nursing,-1,,,2026-02-28 06:01:00+00:00
Democratic-led states challenge the Trump administration's new caps on federal student loans,https://abcnews.com/Business/wireStory/democratic-led-states-challenge-trump-administrations-new-caps-133123561,-1,,,2026-05-19 19:51:38+00:00
Statement of AAU President Barbara R. Snyder on the Administration’s Dismissal of National Science Board Members,https://www.aau.edu/newsroom/press-releases/administrations-dismissal-national-science-board,-1,,,2026-04-25 00:00:00+00:00
Tulane Hillel’s ‘Israel Fest’ celebrates Israeli culture • The Tulane Hullabaloo,https://tulanehullabaloo.com/74921/news/tulane-hillels-israel-fest-celebrates-israeli-culture/,-1,,,2026-04-26 00:00:00+00:00
Dr. Susan Davies announced new dean of School of Social Work • The Tulane Hullabaloo,https://tulanehullabaloo.com/74926/news/dr-susan-davies-announced-new-dean-of-school-of-social-work/,-1,,,2026-04-26 00:00:00+00:00
Why Students Stop Out—and What Brings Them Back,https://www.insidehighered.com/news/student-success/college-experience/2026/04/27/why-students-stop-out-and-what-brings-them-back,-1,,,2026-04-27 00:00:00+00:00
Crimes Unit Reviewing Report That N.C. A&T Funded Officials’ Relatives,https://www.insidehighered.com/news/quick-takes/2026/04/27/audit-nc-wrongly-funded-officials-student-relatives,-1,,,2026-04-27 00:00:00+00:00
White House Ousts Entire National Science Board,https://www.insidehighered.com/news/quick-takes/2026/04/27/white-house-ousts-entire-national-science-board,-1,,,2026-04-27 00:00:00+00:00
Pause on Some OPT Applications Has Left Students in Limbo for Months,https://www.insidehighered.com/news/global/international-students-us/2026/04/27/opt-application-pause-leaves-students-limbo,-1,,,2026-04-27 00:00:00+00:00
Texas Politicians Are Taking Curricular Control. Where Is the Accreditor?,https://www.insidehighered.com/news/governance/accreditation/2026/04/27/accreditor-mum-texas-politicians-take-curricular-control,-1,,,2026-04-27 00:00:00+00:00
"Students, Staff, Alumni Sue Martin Over Closure",https://www.insidehighered.com/news/governance/trustees-regents/2026/04/27/students-staff-alumni-sue-martin-over-closure,-1,,,2026-04-27 00:00:00+00:00
Education Department Launches New FAFSA Fraud Prevention Tool,https://www.insidehighered.com/news/government/student-aid-policy/2026/04/27/education-dept-launches-new-fafsa-fraud-prevention,-1,,,2026-04-27 00:00:00+00:00
Board Ouster Raises Further Concerns About NSF’s Future,https://www.insidehighered.com/news/government/science-research-policy/2026/04/27/board-ouster-raises-further-concerns-about-nsfs,-1,,,2026-04-27 00:00:00+00:00
