Title,Link,Cluster,Event_Severity,Event_Label,Published_utc
How one Alabama senator's quiet diplomacy helped end longest shutdown in US history,https://www.foxnews.com/politics/how-one-alabama-senators-quiet-diplomacy-helped-end-longest-shutdown-us-history,-1,,,2025-11-24 19:53:52+00:00
Trial set in case challenging Miami land transfer for Trump's presidential library,https://abcnews.go.com/US/wireStory/august-trial-set-case-challenging-miami-land-transfer-127840531,-1,,,2025-11-24 22:40:15+00:00
Trump signs order creating Genesis Mission to boost AI-driven research,https://thehill.com/policy/technology/5621021-expanding-ai-scientific-discovery/,-1,,,2025-11-24 23:00:06+00:00
How life is changing for trans Americans under the Trump administration,https://www.pbs.org/newshour/show/how-life-is-changing-for-trans-americans-under-the-trump-administration,-1,,,2025-11-24 23:30:16+00:00
Report: ED Using NDAs As Part of Outsourcing Talks,https://www.insidehighered.com/news/quick-takes/2025/11/25/report-ed-using-ndas-part-outsourcing-talks,-1,,,2025-11-25 00:00:00+00:00
Trump Orders Construction of A.I. Platform to Use Troves of Government Data for Research,https://www.nytimes.com/2025/11/24/us/politics/trump-ai-executive-order.html,-1,,,2025-11-25 01:36:16+00:00
Donald Trump did shock and awe in 2025. Reality may bite in 2026,https://economictimes.indiatimes.com/news/international/world-news/donald-trump-did-shock-and-awe-in-2025-reality-may-bite-in-2026/articleshow/125556184.cms,-1,,,2025-11-25 05:47:00+00:00
"FY 2026 NIH Extramural Loan Repayment Programs Deadline Extended to December 4, 2025",https://grants.nih.gov/news-events/nih-extramural-nexus-news/2025/11/fy-2026-nih-extramural-loan-repayment-programs-deadline-extended-to-december-4-2025,-1,,,2025-11-25 13:55:58+00:00
More Canada Trade Data Delayed as US Shutdown Adds to Backlog,https://www.bloomberg.com/news/articles/2025-11-25/more-canada-trade-data-delayed-as-us-shutdown-adds-to-backlog,-1,,,2025-11-25 16:55:35+00:00
"College savings accounts not affected by cyber incident, Louisiana official says",https://lailluminator.com/briefs/losfa-cyber/,-1,,,2025-11-25 19:28:23+00:00
UC Berkeley Faces Federal Probe After Turning Point Protest,https://www.bloomberg.com/news/articles/2025-11-25/uc-berkeley-faces-federal-probe-after-turning-point-protest,-1,,,2025-11-25 19:56:50+00:00
"Vahid Abedini, University of Oklahoma Professor, Released After ICE Detainment",https://www.nytimes.com/2025/11/25/us/vahid-abedini-oklahoma-professor-ice.html,-1,,,2025-11-25 20:35:19+00:00
Does the Trump administration consider nurses professionals? Yes and no.,https://www.washingtonpost.com/education/2025/11/25/graduate-student-loan-limits-controversy/,-1,,,2025-11-25 23:20:52+00:00
How artificial intelligence is reshaping college for students and professors,https://www.pbs.org/newshour/show/how-artificial-intelligence-is-reshaping-college-for-students-and-professors,-1,,,2025-11-25 23:35:20+00:00
Suit to block Education Department closure expanded amid agency transfers plans,https://lailluminator.com/2025/11/25/repub/education-department-4/,-1,,,2025-11-26 00:10:09+00:00
School Groups Sue to Stop Dismantling of the Education Department,https://www.nytimes.com/2025/11/25/us/politics/school-coalition-lawsuit-education-department.html,-1,,,2025-11-26 01:04:34+00:00
"Trump Pledges Immigration Pause, Markets Defy CME Stress, More",https://www.bloomberg.com/news/audio/2025-11-28/trump-pledges-immigration-pause-markets-defy-cme-stress-more,-1,,,2025-11-28 19:19:50+00:00
Northwestern Reaches $75 Million Deal With Trump Administration,https://www.bloomberg.com/news/articles/2025-11-29/northwestern-reaches-75-million-deal-with-trump-administration,-1,,,2025-11-29 01:45:15+00:00
Northwestern Agrees to Deal With Trump Administration,https://www.nytimes.com/2025/11/28/us/politics/northwestern-deal-trump-administration.html,-1,,,2025-11-29 02:43:10+00:00
Trump Administration Reaches Deal With Northwestern University To Restore Funding,https://www.huffpost.com/entry/trump-administration-deal-northwestern-university_n_692a67ede4b0dee467c89113,-1,,,2025-11-29 03:33:28+00:00
Trump Pauses All Asylum Applications and Halts Visas for Afghans,https://www.nytimes.com/2025/11/28/us/politics/trump-affirmative-asylum.html,-1,,,2025-11-29 03:56:06+00:00
Northwestern agrees to pay $75M to restore funding amid Trump antisemitism probe,https://thehill.com/homenews/education/5626206-northwestern-trump-administration-75m-deal-antisemitism-probe/,-1,,,2025-11-29 13:14:00+00:00
Meet the Millionaire Masters of Early Decision at Colleges,https://www.nytimes.com/2025/11/29/business/tulane-university-chicago-early-decision.html,-1,,,2025-11-29 14:34:28+00:00
Northwestern Reaches $75M Deal with Trump Administration,https://www.today.com/video/northwestern-university-agrees-to-pay-trump-administration-253291077652,-1,,,2025-11-29 15:02:31+00:00
Lane Kiffin's meeting with Ole Miss team delayed as signs point to him taking LSU job,https://www.theadvocate.com/baton_rouge/sports/lsu/lane-kiffins-meeting-with-ole-miss-team-delayed-as-signs-point-to-him-taking-lsu/article_cea0defa-71b1-5368-b33c-10c7f8bb77ea.html,-1,,,2025-11-30 15:27:00+00:00
12 Ways to Improve College for Military Learners,https://www.insidehighered.com/news/student-success/college-experience/2025/12/01/12-ways-improve-college-military-learners,-1,,,2025-12-01 00:00:00+00:00
College Student Is Deported During Trip Home for Thanksgiving,https://www.nytimes.com/2025/11/30/us/politics/college-student-deported-thanksgiving-texas.html,-1,,,2025-12-01 01:36:26+00:00
New cancer therapy hunts and destroys deadly tumors in major breakthrough study,https://www.foxnews.com/health/new-cancer-therapy-hunts-destroys-deadly-tumors-major-breakthrough-study,-1,,,2025-12-01 12:00:25+00:00
How incoming federal loan caps could impact med students,https://www.statnews.com/2025/12/01/health-news-federal-loan-caps-for-med-school/?utm_campaign=rss,-1,,,2025-12-01 12:55:35+00:00
RFK Jr. Names Controversial Vaccine Adviser to Senior HHS Role,https://www.bloomberg.com/news/articles/2025-12-01/rfk-jr-names-controversial-vaccine-advisor-to-senior-hhs-role,-1,,,2025-12-01 16:35:08+00:00
Philanthropist MacKenzie Scott Doles Out Another Round of Transformative Gifts,https://www.insidehighered.com/news/quick-takes/2025/12/02/philanthropist-mackenzie-scott-doles-out-more-gifts,-1,,,2025-12-02 00:00:00+00:00
Education,https://www.christianpost.com/category/education,-1,,,2025-12-02 05:46:00+00:00
"The Election That Has Republicans on Edge, and How One College Student Was Deported",https://www.nytimes.com/2025/12/02/podcasts/the-headlines/tennessee-elections-college-student-deported.html,-1,,,2025-12-02 11:00:14+00:00
"Heavy drinkers cut alcohol use by nearly 30% after adopting one new habit, study finds",https://www.foxnews.com/health/heavy-drinkers-cut-alcohol-use-nearly-30-after-adopting-one-new-habit-study-finds,-1,,,2025-12-02 12:00:43+00:00
Trump to Expand Travel Ban as US Tightens Curbs After Shooting,https://www.bloomberg.com/news/articles/2025-12-02/trump-to-expand-travel-ban-to-around-30-countries-after-shooting,-1,,,2025-12-02 17:14:13+00:00
"University of Alabama suspends magazines for Black, female students",https://lailluminator.com/2025/12/02/repub/alabama-student-magazines/,-1,,,2025-12-02 18:53:53+00:00
"Despite legal challenge, Florida college votes again to transfer land for Trump presidential library",https://abcnews.go.com/US/wireStory/despite-legal-challenge-florida-college-votes-transfer-land-128050209,-1,,,2025-12-02 19:41:37+00:00
The 85-Year-Old Activist Trying to Block the Trump Presidential Library Plan,https://www.nytimes.com/2025/12/02/us/trump-library.html,-1,,,2025-12-02 19:58:32+00:00
Larry Summers Barred for Life From American Economic Association,https://www.bloomberg.com/news/articles/2025-12-02/larry-summers-barred-for-life-from-american-economic-association,-1,,,2025-12-02 20:54:02+00:00
Freedom Caucus members stall House floor action over SCORE Act,https://thehill.com/homenews/house/5630564-house-freedom-caucus-delays-score-act/,-1,,,2025-12-02 21:03:39+00:00
NASA Awards Lunar Freezer System Contract,https://www.nasa.gov/news-release/nasa-awards-lunar-freezer-system-contract/,-1,,,2025-12-02 21:12:39+00:00
Trump rips Somali community as federal agents reportedly eye Minnesota enforcement sweep,https://www.foxnews.com/politics/trump-rips-somali-community-as-federal-agents-reportedly-eye-minnesota-enforcement-sweep,-1,,,2025-12-02 22:23:24+00:00
"Student coalition, Democrats object to Trump education department moves",https://lailluminator.com/2025/12/02/repub/education-department-5/,-1,,,2025-12-02 22:27:27+00:00
"Scott Rabalais: After early turbulence, new LSU AD Verge Ausberry landed the Lane plane",https://www.theadvocate.com/baton_rouge/sports/lsu/lsu-lane-kiffin-verge-ausberry-coaching-search-jeff-landry-wade-rousse/article_fe5b914d-8061-5409-87b5-f981fde1af62.html,-1,,,2025-12-02 22:37:00+00:00
More 4-year colleges offer 2-year degrees to reach new groups of students,https://www.pbs.org/newshour/show/more-4-year-colleges-offer-2-year-degrees-to-reach-new-groups-of-students,-1,,,2025-12-02 23:40:21+00:00
FAFSA Completion Is Up,https://www.insidehighered.com/news/quick-takes/2025/12/03/fafsa-completion,-1,,,2025-12-03 00:00:00+00:00
Chief Diversity Officers Report Stress Amid Shifting Roles,https://www.insidehighered.com/news/quick-takes/2025/12/03/chief-diversity-officers-report-stress-amid-shifting-roles,-1,,,2025-12-03 00:00:00+00:00
U.S. Pauses Immigration Applications From Nations on Travel Ban List,https://www.nytimes.com/2025/12/02/us/politics/trump-travel-ban-citizenship-green-cards-dc-shooting.html,-1,,,2025-12-03 01:14:13+00:00
Why Harvard Has Not Reached a Deal with Trump,https://www.nytimes.com/2025/12/03/us/politics/trump-harvard.html,-1,,,2025-12-03 13:00:06+00:00
Trump administration puts a hold on immigration applications from 19 nations,https://lailluminator.com/2025/12/03/repub/immigration-applications/,-1,,,2025-12-03 16:51:05+00:00
"University of Alabama shuts down Black, female student magazines",https://thehill.com/homenews/education/5631873-university-of-alabama-shutters-diverse-student-magazines/,-1,,,2025-12-03 18:54:38+00:00
Louisiana Revenue Secretary Richard Nelson named community college system president,https://lailluminator.com/2025/12/03/louisiana-revenue-secretary-richard-nelson-named-community-college-system-president/,-1,,,2025-12-03 19:14:41+00:00
House cancels vote on the SCORE Act amid GOP opposition,https://thehill.com/homenews/house/5632295-house-score-act-nil-gop-opposition/,-1,,,2025-12-03 20:37:44+00:00
"U. of Alabama Suspends Black and Female Student Magazines, Citing D.E.I. Guidance",https://www.nytimes.com/2025/12/02/us/u-of-alabama-student-magazines-dei.html,-1,,,2025-12-03 22:09:21+00:00
Proposal to declassify nursing as &#8216;professional&#8217; threatens ability to secure student loans,https://www.pbs.org/newshour/show/proposal-to-declassify-nursing-as-professional-threatens-ability-to-secure-student-loans,-1,,,2025-12-03 23:40:29+00:00
Ex-Oak View CEO Leiweke Pardoned by Trump in Bid-Rigging Case,https://www.bloomberg.com/news/articles/2025-12-04/ex-oak-view-ceo-leiweke-pardoned-by-trump-in-bid-rigging-case,-1,,,2025-12-04 01:33:21+00:00
Lawsuit Against Hispanic Scholarship Fund Argues It Discriminates Against Non-Hispanic Students,https://www.nytimes.com/2025/12/03/us/hispanic-scholarship-fund-lawsuit-discrimination.html,-1,,,2025-12-04 01:51:21+00:00
"Chris Henry Jr. Commits to OSU Despite Oregon, USC Interest on Early NSD",https://www.el-balad.com/6784277,-1,,,2025-12-04 05:47:00+00:00
Opinion: Can chatting with strangers improve public health?,https://www.statnews.com/2025/12/04/public-health-communication-maha-strangers-information-vaccines/?utm_campaign=rss,-1,,,2025-12-04 09:30:00+00:00
A Growing U.S. Tech Hub Needs Workers. Colleges Try to Keep Up.,https://www.nytimes.com/2025/12/04/business/tsmc-arizona-workers-training.html,-1,,,2025-12-04 10:00:29+00:00
International students worry about holiday travel amid immigration crackdown,https://thehill.com/homenews/education/5631840-international-students-holiday-travel-trump-immigration-crackdown/,-1,,,2025-12-04 11:00:00+00:00
"December 25 (Thursday), 2025: NIH Closed for the Federal Holiday",https://grants.nih.gov/news-events/nih-extramural-nexus-news/2025/12/december-25-thursday-2025-nih-closed-for-the-federal-holiday,-1,,,2025-12-04 15:07:19+00:00
What Are the Differences Between Highlighted Topics and Funding Opportunities?,https://grants.nih.gov/news-events/nih-extramural-nexus-news/2025/12/what-are-the-differences-between-highlighted-topics-and-funding-opportunities,-1,,,2025-12-04 22:20:52+00:00
Retiring US Sen. Durbin makes last push for long-stalled immigration bill,https://lailluminator.com/2025/12/04/repub/durbin-immigration/,-1,,,2025-12-04 22:33:54+00:00
U.S. work authorizations for legal immigrants slashed from 5 years to 18 months,https://lailluminator.com/2025/12/04/repub/work-immigrants/,-1,,,2025-12-04 22:36:52+00:00
Senate Dems to McMahon: Efforts to shift Education Department responsibilities illegal,https://thehill.com/homenews/senate/5634520-education-department-program-breakup-criticized/,-1,,,2025-12-04 23:34:31+00:00
More Colleges Celebrate Gifts From Philanthropist MacKenzie Scott,https://www.insidehighered.com/news/quick-takes/2025/12/05/more-colleges-celebrate-gifts-philanthropist-mackenzie-scott,-1,,,2025-12-05 00:00:00+00:00
Fate of Accountability for Undergraduate Certificates Likely to Loom Over ED Talks,https://www.insidehighered.com/news/government/student-aid-policy/2025/12/05/how-talks-over-new-earnings-test-could-ensnare,-1,,,2025-12-05 00:00:00+00:00
Tom Homan fumes at protester who called him racist during clash at TPUSA event: 'Grow a backbone',https://www.foxnews.com/politics/tom-homan-fumes-protester-who-called-him-racist-during-clash-tpusa-event-grow-backbone,-1,,,2025-12-05 08:58:27+00:00
U.S. Supreme Court to decide whether Trump's birthright citizenship order violates Constitution,https://www.cbc.ca/news/world/supreme-court-trump-birthright-citizenship-order-9.7004978?cmp=rss,-1,,,2025-12-05 14:51:16+00:00
"US Consumer Spending Stalled in September, Inflation in Line",https://www.bloomberg.com/news/articles/2025-12-05/us-consumer-spending-stalled-in-september-inflation-as-expected,-1,,,2025-12-05 15:03:17+00:00
PCE Report Shows Consumer Prices Rose Slightly in September,https://www.nytimes.com/2025/12/05/business/pce-data-inflation-consumer-prices.html,-1,,,2025-12-05 16:07:38+00:00
Best UAH Bookstore Coupons & Promo Codes,https://kafila.org/uah-bookstore/,-1,,,2025-12-05 16:32:00+00:00
How to make your first student loan payment,https://finance.yahoo.com/personal-finance/student-loans/article/first-student-loan-payment-170048828.html,-1,,,2025-12-05 17:00:48+00:00
Michigan State Gets Record $401 Million Pledge to Boost Sports,https://www.bloomberg.com/news/articles/2025-12-05/michigan-state-gets-record-401-million-pledge-to-boost-sports,-1,,,2025-12-05 17:30:56+00:00
Library Agency Reinstates Grants Canceled by Trump Administration,https://www.nytimes.com/2025/12/05/arts/imls-library-grants-trump.html,-1,,,2025-12-05 19:42:47+00:00
"A four-star offensive lineman, once committed to LSU, has flipped his signature to Alabama",https://www.theadvocate.com/baton_rouge/sports/lsu/bryson-cooley-lsu-football-recruiting-alabama-lane-kiffin/article_3b84974b-3d11-5cfc-b670-3ef3df079875.html,-1,,,2025-12-05 21:46:00+00:00
Trump Education Department Calls Back 260 Staff It Tried to Fire,https://www.bloomberg.com/news/articles/2025-12-05/trump-education-department-calls-back-260-staff-it-tried-to-fire,-1,,,2025-12-05 22:36:49+00:00
Lawmakers debate next steps on college sports legislation,https://thehill.com/homenews/nexstar_media_wire/5636422-college-athlete-compensation-debate/,-1,,,2025-12-06 03:14:36+00:00
ICE Arrests Harvard Professor Charged for Shooting a Pellet Gun,https://www.nytimes.com/2025/12/05/us/ice-harvard-carlos-portugal-pellet-gun.html,-1,,,2025-12-06 12:14:05+00:00
LSU is expected to hire a new defensive line coach under Lane Kiffin with SEC experience,https://www.theadvocate.com/baton_rouge/sports/lsu/elijah-robinson-hired-lsu-defensive-line-lane-kiffin/article_ae20d4a8-61fe-5f91-bcb5-4ead6362f05a.html,-1,,,2025-12-06 16:23:00+00:00
A Right-Wing Playbook to Weaken Colleges from Within,https://www.nytimes.com/2025/12/06/opinion/college-student-complaints.html,-1,,,2025-12-06 17:25:49+00:00
Americans to get free entry to parks on Trump's birthday,https://www.bbc.com/news/articles/cr7l4n89lr1o?at_medium=RSS&at_campaign=rss,-1,,,2025-12-06 19:32:41+00:00
Blake Baker agreed to a new contract to stay at LSU. Here are the details.,https://www.theadvocate.com/baton_rouge/sports/lsu/blake-baker-contract-lsu-defensive-coordinator-lane-kiffin/article_9780aeee-a4bc-5166-b81b-ca1c73581f67.html,-1,,,2025-12-06 21:45:00+00:00
MIT Creates an AI Labor Index as AI Invades Human Economies,https://drudge.com/news/288417/mit-creates-ai-labor-index-ai-invades,-1,,,2025-12-06 21:46:00+00:00
"Tulane seeded No. 11, to play Ole Miss in first playoff in program history • The Tulane Hullabaloo",https://tulanehullabaloo.com/72416/news/tulane-ranks-no-11-to-play-ole-miss-in-first-playoff-in-program-history/,-1,,,2025-12-07 00:00:00+00:00
Harvard hit by new breach after phone phishing attack,https://www.foxnews.com/tech/harvard-hit-new-breach-after-phone-phishing-attack,-1,,,2025-12-07 15:36:43+00:00
"US Economy to Finish 2025 With 3% Growth, Bessent Says",https://www.bloomberg.com/news/articles/2025-12-07/us-economy-to-finish-2025-with-3-growth-bessent-says,-1,,,2025-12-07 16:02:24+00:00
GOP lawmakers get heated over college football and money,https://thehill.com/homenews/house/5636237-college-sports-nil-debate/,-1,,,2025-12-08 11:00:00+00:00
New student loan rule could dissuade people from advanced nursing degrees,https://lailluminator.com/2025/12/08/repub/student-loan-nursing/,-1,,,2025-12-08 12:27:29+00:00
State Department reportedly orders visa denials tied to speech censorship as Trump team slams Europe,https://www.foxnews.com/world/state-department-reportedly-orders-visa-denials-tied-speech-censorship-trump-team-slams-europe,-1,,,2025-12-08 16:16:14+00:00
Family of student deported to Honduras say they were targeted by ICE agents,https://www.theguardian.com/us-news/2025/dec/08/ice-family-college-student-deported-honduras,-1,,,2025-12-08 18:41:51+00:00
Reporter's Notebook: House Dems question sports bill timing amid Lane Kiffin controversy,https://www.foxnews.com/politics/reporters-notebook-house-dems-question-sports-bill-timing-amid-lane-kiffin-controversy,-1,,,2025-12-08 21:55:56+00:00
US Education Department civil rights staff returning to work to tackle complaint backlog,https://lailluminator.com/2025/12/08/repub/education-civil-rights/,-1,,,2025-12-08 22:28:02+00:00
University of Oklahoma Removes a Teacher It Says Urged Students to Protest,https://www.nytimes.com/2025/12/08/us/oklahoma-university-removes-instructor-protest-bible-gender.html,-1,,,2025-12-08 22:29:38+00:00
Greg Abbott makes major announcement about Turning Point USA in Texas,https://www.foxnews.com/politics/greg-abbott-makes-major-announcement-about-turning-point-usa-texas,-1,,,2025-12-08 22:45:09+00:00
Trump Promises Executive Order to Block State AI Regulations,https://www.nytimes.com/2025/12/08/us/politics/trump-executive-order-ai-laws.html,-1,,,2025-12-08 22:49:10+00:00
"Florida designates Muslim Brotherhood and CAIR as foreign terrorist organizations, DeSantis says",https://www.foxnews.com/politics/florida-designates-muslim-brotherhood-cair-foreign-terrorist-organizations-desantis-says,-1,,,2025-12-08 23:15:14+00:00
Here are 3 ways to lock in this finals week - The Baylor Lariat,https://baylorlariat.com/2025/12/08/here-are-3-ways-to-lock-in-this-finals-week/,-1,,,2025-12-09 05:46:00+00:00
LSU researcher invents whole new ball game to boost public health research,https://lailluminator.com/2025/12/09/lsu-researcher-invents-whole-new-ball-game-to-boost-public-health-research/,-1,,,2025-12-09 16:02:20+00:00
Cedric Richmond turns down interim Southern presidency,https://lailluminator.com/2025/12/09/cedric-richmond-turns-down-interim-southern-presidency/,-1,,,2025-12-09 16:07:22+00:00
Education Department announces end of SAVE student loan repayment plan,https://thehill.com/homenews/education/5640758-save-plan-student-loans-repayment-debt-forgiveness/,-1,,,2025-12-09 18:48:59+00:00
"January 1 (Thursday), 2026: NIH Closed for the Federal Holiday",https://grants.nih.gov/news-events/nih-extramural-nexus-news/2025/12/january-1-thursday-2026-nih-closed-for-the-federal-holiday,-1,,,2025-12-09 19:12:24+00:00
Trump administration aims to officially scrap Biden student loan forgiveness program,https://lailluminator.com/2025/12/09/repub/student-loan-3/,-1,,,2025-12-09 20:25:30+00:00
"Illinois law protects immigrants from arrest near courthouses, hospitals or colleges",https://thehill.com/homenews/state-watch/illinois-immigration-arrest-restrictions/,-1,,,2025-12-09 20:28:24+00:00
Pritzker signs bill to further shield illegal immigrants in Illinois from deportations,https://www.foxnews.com/politics/pritzker-signs-bill-further-shield-illegal-immigrants-illinois-deportations,-1,,,2025-12-09 20:45:48+00:00
Mackenzie Scott Announces $7 Billion of Giving This Year,https://www.nytimes.com/2025/12/09/business/mackenzie-scott-philanthropy.html,-1,,,2025-12-09 22:07:57+00:00
Education Department pushes to end SAVE payment program for millions of student loan holders,https://www.krtv.com/us-news/education/education-department-pushes-to-end-save-payment-program-for-millions-of-student-loan-holders,-1,,,2025-12-10 05:47:00+00:00
The Conservative Overhaul of the University of Texas Is Underway,https://www.nytimes.com/2025/12/10/us/university-of-texas-republicans-academic-freedom-faculty.html,-1,,,2025-12-10 10:00:33+00:00
Trump Administration Rules Threaten Nobel Prizes Won by Immigrants,https://www.nytimes.com/2025/12/10/science/nobel-prize-immigrants-science.html,-1,,,2025-12-10 10:03:40+00:00
"US Department of Labor issues 7 letters of interpretation addressing workplace safety, health requirements",https://www.osha.gov/news/newsreleases/osha-national-news-release/20251210,-1,,,2025-12-10 12:00:00+00:00
The Early Decision Option Is a Racket. Shut It Down.,https://www.nytimes.com/2025/12/10/opinion/college-admission-early-decision-application.html,-1,,,2025-12-10 17:28:33+00:00
How a Small Private Equity Firm Beat Larger Rivals to Win First College Sports Deal,https://www.bloomberg.com/news/articles/2025-12-10/otro-capital-becomes-first-pe-firm-to-win-college-sports-deal,-1,,,2025-12-10 18:22:42+00:00
Key Takeaways From Fed Decision to Cut Rate by Quarter-Point,https://www.bloomberg.com/news/articles/2025-12-10/key-takeaways-from-fed-decision-to-cut-rate-by-quarter-point,-1,,,2025-12-10 19:00:01+00:00
"Fed Cuts Rates With Three Dissents, Projects One Cut in 2026",https://www.bloomberg.com/news/articles/2025-12-10/fed-cuts-rates-with-three-dissents-projects-one-cut-in-2026,-1,,,2025-12-10 19:00:01+00:00
Fed Quells Market Angst With $40 Billion Monthly Bill Purchases,https://www.bloomberg.com/news/articles/2025-12-10/fed-says-it-will-begin-treasury-bill-purchases-on-dec-12,-1,,,2025-12-10 19:09:33+00:00
"Parent Is Suspect in Fatal Shooting at Kentucky State University, Officials Say",https://www.nytimes.com/2025/12/09/us/shooting-kentucky-state-university.html,-1,,,2025-12-10 20:35:26+00:00
"Fed lowers interest rates again amid debate over inflation, jobs",https://www.washingtonpost.com/business/2025/12/10/federal-reserve-rate-cut-stagflation/,-1,,,2025-12-10 21:50:16+00:00
What the end of a Biden-era student loan program means for borrowers,https://www.pbs.org/newshour/show/what-the-end-of-a-biden-era-student-loan-program-means-for-borrowers,-1,,,2025-12-10 23:30:40+00:00
Fed Cuts Interest Rate Third Time in a Row,https://www.bloomberg.com/news/newsletters/2025-12-10/fed-cuts-rate-third-time-in-a-row-evening-briefing-americas,-1,,,2025-12-10 23:41:24+00:00
Youngkin Loses Battle Over Virginia Board Picks,https://www.insidehighered.com/news/quick-takes/2025/12/11/youngkin-loses-battle-over-board-picks,-1,,,2025-12-11 00:00:00+00:00
ICE Says It Has No Videos to Release of Chicago Deportation Operations,https://www.nytimes.com/2025/12/10/us/politics/ice-bodycam-video-chicago.html,-1,,,2025-12-11 02:37:51+00:00
Fired Michigan Coach Sherrone Moore Arrested | NewsTalk 1230,https://newstalk1230.iheart.com/content/2025-12-10-fired-michigan-coach-sherrone-moore-arrested/,-1,,,2025-12-11 05:47:00+00:00
I got wet at Armand Hammer (and it was amazing) | WRBB 104.9 FM,https://wrbbradio.org/articles/i-got-wet-at-armand-hammer-and-it-was-amazing,-1,,,2025-12-11 05:47:00+00:00
Michigan head football coach Moore detained by police in Saline,https://wcyb.com/news/nation-world/sherrone-moore-university-michigan-detained-saline-pittsfield-township-investigation-potential-charges-washtenaw-county-state,-1,,,2025-12-11 05:47:00+00:00
"LSU president, chancellor can earn millions in incentives",https://lailluminator.com/2025/12/11/lsu-president-chancellor-can-earn-millions-in-incentives/,-1,,,2025-12-11 19:33:24+00:00
Lecturer Sanctioned Over MAGA White Supremacy Lesson Is Back in Class,https://www.nytimes.com/2025/12/11/us/indiana-university-professor-sanctioned-maga-white-supremacy-lesson.html,-1,,,2025-12-11 19:37:23+00:00
Noem announces $1B FEMA payout to Georgia as Trump administration eyes agency overhaul,https://www.foxnews.com/politics/noem-announces-1b-fema-payout-georgia-trump-administration-eyes-agency-overhaul,-1,,,2025-12-11 23:10:53+00:00
