Title,Link,Cluster,Event_Severity,Event_Label,Published_utc
Federal Worker Unions Ask Judge to Halt Shutdown Layoffs,https://www.bloomberg.com/news/articles/2025-10-10/federal-worker-unions-seek-immediate-halt-to-shutdown-layoffs,-1,,,2025-10-10 17:52:05+00:00
MIT Rejects Special Funding Offer From Trump Administration,https://www.nytimes.com/2025/10/10/us/mit-rejects-white-house-compact.html,-1,,,2025-10-10 18:05:56+00:00
Student Loan Cancellation Is Restarting for Some Federal Borrowers,https://www.nytimes.com/2025/10/10/business/student-loan-forgiveness-ibr.html,-1,,,2025-10-10 19:17:01+00:00
Leftist club smears Charlie Kirk on campus flyers spotted ahead of their event honoring George Floyd instead,https://www.foxnews.com/politics/leftist-club-smears-charlie-kirk-campus-flyers-spotted-ahead-event-honoring-george-floyd,-1,,,2025-10-10 20:00:18+00:00
"MIT Scores 15% Gain to Boost Fund to $27 Billion, Warns of Taxes",https://www.bloomberg.com/news/articles/2025-10-10/mit-scores-15-gain-to-boost-fund-to-27-billion-warns-of-taxes,-1,,,2025-10-10 20:35:24+00:00
Here are the agencies affected by shutdown layoffs,https://thehill.com/homenews/administration/5550188-government-layoffs-trump-administration/,-1,,,2025-10-10 20:43:13+00:00
"Republicans, Trump, Democrats share shutdown blame: Survey",https://thehill.com/homenews/administration/5550314-shutdown-blame-republicans-democrats/,-1,,,2025-10-10 21:55:29+00:00
Federal Workers Fired Amid Government Shutdown | Early Balance of Power 10/10/25,https://www.bloomberg.com/news/videos/2025-10-10/balance-of-power-early-edition-10-10-2025-video,-1,,,2025-10-10 21:59:56+00:00
"Trump showing &#8216;no interest&#8217; in negotiating to end shutdown, Jeffries says",https://www.pbs.org/newshour/show/trump-showing-no-interest-in-negotiating-to-end-shutdown-jeffries-says,-1,,,2025-10-10 22:40:06+00:00
News Wrap: 19 missing and feared dead after blast at Tennessee explosives plant,https://www.pbs.org/newshour/show/news-wrap-19-missing-and-feared-dead-after-blast-at-tennessee-explosives-plant,-1,,,2025-10-10 22:50:52+00:00
"The White House has identified more than 4,100 federal workers for layoffs as the shutdown drags on",https://www.businessinsider.com/federal-worker-firings-during-government-shutdown-what-we-know-2025-10,-1,,,2025-10-10 22:53:36+00:00
Trump administration begins laying off federal workers amid shutdown,https://www.washingtonpost.com/business/2025/10/10/trump-federal-workers-layoffs-government-shutdown/,-1,,,2025-10-10 22:55:30+00:00
Trump administration fires at least 4.1K federal workers in shutdown layoffs,https://thehill.com/homenews/administration/5550505-trump-administration-layoffs-shutdown/,-1,,,2025-10-10 23:02:21+00:00
Live updates: Trump says federal layoffs will be 'Democrat-oriented',https://thehill.com/homenews/administration/5548023-live-updates-trump-nobel-government-shutdown-gaza-deal/,-1,,,2025-10-10 23:06:08+00:00
White House Signals Federal Layoffs Have Begun Amid Government Shutdown,https://www.nytimes.com/2025/10/10/us/politics/federal-layoffs-government-shutdown.html,-1,,,2025-10-11 01:51:02+00:00
Lost Girl Rider University,https://princetonol.com/events/2025-10-11/lost-girl-rider-university,-1,,,2025-10-11 05:32:00+00:00
Mizzou Golden Girls mourn alumna Josie Woodward,https://www.komu.com/news/midmissourinews/mizzou-golden-girls-mourn-alumna-josie-woodward/article_9b690314-1319-4e9b-9693-550c45d2fc4f.html,-1,,,2025-10-11 05:32:00+00:00
Not Even Congress Knows How Much Money DOGE Cut,https://www.nytimes.com/2025/10/11/upshot/congress-doge-cuts-mystery.html,-1,,,2025-10-11 09:01:40+00:00
How the Government Shutdown Will Be Felt,https://www.nytimes.com/video/us/politics/100000010447931/how-the-government-shutdown-will-be-felt.html,-1,,,2025-10-11 09:02:00+00:00
Firings of U.S. federal workers begin as White House seeks to pressure Democrats in government shutdown,https://www.cbc.ca/news/world/white-house-federal-firings-9.6935906?cmp=rss,-1,,,2025-10-11 09:28:36+00:00
Cal Poly Cat Program hosts adoption event at Arroyo Grande bookstore,https://www.ksby.com/arroyo-grande/cal-poly-cat-program-hosts-adoption-event-at-arroyo-grande-bookstore,-1,,,2025-10-12 05:31:00+00:00
"1 dead, 2 injured in shooting at Alcorn State",https://www.wpbf.com/article/shooting-reported-on-alcorn-state-university-campus/69008044,-1,,,2025-10-12 05:31:00+00:00
Kentucky Kernel,https://kykernel.com/staff_name/tyler-russell/,-1,,,2025-10-12 05:31:00+00:00
Pressure growing on Johnson to call House back amid shutdown fight,https://thehill.com/homenews/house/5550435-pressure-mike-johnson-house-shutdown/,-1,,,2025-10-12 10:00:00+00:00
The pain from the government shutdown is about to hit the public,https://www.washingtonpost.com/business/2025/10/12/government-shutdown-economy-pain/,-1,,,2025-10-12 11:00:00+00:00
"I was accepted into NYU, but chose a community college certification instead. Being debt-free was more important than prestige.",https://www.businessinsider.com/student-turned-down-nyu-debt-free-community-college-path-2025-10,-1,,,2025-10-12 11:17:02+00:00
He was a homeless college student. He found hope in a parking lot.,https://www.washingtonpost.com/nation/2025/10/12/homeless-student-college-california/,-1,,,2025-10-12 12:00:11+00:00
Scientists crack code on how dietary fiber shields your body from harmful sugar damage,https://www.foxnews.com/health/scientists-crack-code-dietary-fiber-shields-body-harmful-sugar-damage,-1,,,2025-10-12 20:06:51+00:00
DC Tourists Frustrated by Museum Closures as Shutdown Persists,https://www.bloomberg.com/news/articles/2025-10-12/dc-tourists-frustrated-by-museum-closures-as-shutdown-persists,-1,,,2025-10-12 22:07:40+00:00
International,https://www.winknews.com/news/international/,-1,,,2025-10-13 05:32:00+00:00
Watch live: Johnson speaks as shutdown approaches second week,https://thehill.com/homenews/house/5552535-speaker-mike-johnson-presses/,-1,,,2025-10-13 13:00:00+00:00
"Dwindling paychecks add pressure on GOP, Trump, Democrats to end shutdown",https://thehill.com/homenews/senate/5550429-federal-worker-pay-shutdown-pressure/,-1,,,2025-10-13 14:20:38+00:00
Johnson warns US 'barreling toward one of the longest shutdowns' in history,https://www.foxnews.com/politics/johnson-warns-us-barreling-toward-one-longest-shutdowns-history,-1,,,2025-10-13 16:33:33+00:00
Law Schools Are Using Security Concerns to Silence Speech,https://www.nytimes.com/2025/10/13/opinion/law-schools-trump-free-speech.html,-1,,,2025-10-13 16:56:41+00:00
Education Department layoffs hit offices that oversee special education and civil rights enforcement,https://www.pbs.org/newshour/politics/education-department-layoffs-hit-offices-that-oversee-special-education-and-civil-rights-enforcement,-1,,,2025-10-13 18:04:39+00:00
LSU readjusts timeline to hire next president for White House visit,https://lailluminator.com/briefs/lsu-readjusts-timeline-to-hire-next-president-for-white-house-visit/,-1,,,2025-10-13 19:00:13+00:00
Pentagon to shift research dollars to pay military during shutdown,https://lailluminator.com/2025/10/13/repub/military-pay-shutdown/,-1,,,2025-10-13 19:02:36+00:00
The Godfather of AI warns that cuts to universities will cost the US its AI edge over China,https://www.businessinsider.com/geoffrey-hinton-ai-race-us-china-2025-10,-1,,,2025-10-13 19:31:16+00:00
Government Shutdown Drags on With No Sign of It Ending Anytime Soon,https://www.bloomberg.com/news/newsletters/2025-10-13/government-shutdown-drags-on-with-no-sign-of-it-ending-anytime-soon,-1,,,2025-10-13 20:31:15+00:00
What Happened to Campus Activism Against the War in Gaza?,https://www.nytimes.com/2025/10/13/us/campus-activism-against-the-war-in-gaza.html,-1,,,2025-10-13 20:35:56+00:00
Trump Offers All Colleges Preferential Funding Plan Rejected by MIT,https://www.bloomberg.com/news/articles/2025-10-13/trump-invites-all-colleges-to-join-compact-after-mit-s-rejection,-1,,,2025-10-13 21:43:23+00:00
Need to Pass a Measure to Fund Govt.: Rep. Auchincloss,https://www.bloomberg.com/news/videos/2025-10-13/need-to-pass-a-measure-to-fund-govt-rep-auchincloss-video,-1,,,2025-10-13 22:33:02+00:00
Jeffries tells Lawler to 'keep your mouth shut' as shutdown sparks Capitol Hill confrontations,https://www.foxnews.com/politics/jeffries-tells-lawler-keep-your-mouth-shut-shutdown-sparks-capitol-hill-confrontations,-1,,,2025-10-13 23:57:45+00:00
Penn State Coach Gets $45M Buyout,https://www.insidehighered.com/news/quick-takes/2025/10/14/penn-state-coach-gets-45m-buyout,-1,,,2025-10-14 00:00:00+00:00
How to Make Faculty Affairs Work at Any Institution,https://www.insidehighered.com/news/faculty-issues/career-development/2025/10/14/how-make-faculty-affairs-work-any-institution,-1,,,2025-10-14 00:00:00+00:00
Federal workers express concerns after Speaker Johnson warns of 'one of longest shutdowns',https://kcby.com/news/nation-world/federal-workers-express-concerns-after-speaker-johnson-warns-of-one-of-longest-shutdowns-government-shutdown-furloughed-jobs-employees-paychecks-washington-dc-dmv-rifs-reductions-in-force-president-trump,-1,,,2025-10-14 05:32:00+00:00
Best source for Marin County education news,https://www.marinij.com/news/education/,-1,,,2025-10-14 05:32:00+00:00
Indiana man accused of prompting USNA lockdown in September posted mass violence threat,https://kcby.com/news/nation-world/jackson-elliot-fleming-jodel-app-maryland-anne-arundel-county-annapolis-united-states-naval-academy-navy-midshipmen-indiana-usna-lockdown-shutdown-mass-violence-threat,-1,,,2025-10-14 05:32:00+00:00
Supporting Transfer Student Success Through Data,https://www.insidehighered.com/news/student-success/college-experience/2025/10/15/supporting-transfer-student-success-through-data,-1,,,2025-10-15 00:00:00+00:00
Shutdown may start costing economy $15B a week: Bessent,https://thehill.com/business/5556788-government-shutdown-daily-cost-bessent/,-1,,,2025-10-15 17:37:27+00:00
"STAT+: Funding cuts threaten new generation of cancer immunotherapies, researcher says",https://www.statnews.com/2025/10/16/dr-miriam-merad-research-cuts-threaten-new-cancer-immunotherapy/?utm_campaign=rss,-1,,,2025-10-16 08:30:00+00:00
A Storied Art Collection at Princeton Gets a New Home,https://www.nytimes.com/2025/10/16/arts/princeton-university-art-museum.html,-1,,,2025-10-16 14:40:48+00:00
Food Stamp Funds to Dry Up If Shutdown Persists,https://www.bloomberg.com/news/articles/2025-10-16/food-stamp-funds-to-dry-up-if-shutdown-persists-usda-warns,-1,,,2025-10-16 16:07:16+00:00
Democrats block Defense spending bill as shutdown tensions rise,https://thehill.com/homenews/senate/5558801-defense-spending-bill-shutdown/,-1,,,2025-10-16 18:12:59+00:00
"With funding for courts in question, Congress stuck in shutdown gridlock for day 16",https://lailluminator.com/2025/10/16/repub/shutdown-courts/,-1,,,2025-10-16 20:08:51+00:00
"LSU will have more police, use surveillance drones for game days",https://lailluminator.com/2025/10/16/lsu-will-have-more-police-use-surveillance-drones-for-game-days/,-1,,,2025-10-16 20:49:28+00:00
3 in 4 blame all major players for shutdown: Poll,https://thehill.com/homenews/senate/5559276-poll-government-shutdown-blame-all-parties/,-1,,,2025-10-16 21:00:36+00:00
Penn and U.S.C. Become Latest Universities to Reject White House Deal,https://www.nytimes.com/2025/10/16/us/university-of-pennsylvania-rejects-white-house-deal.html,-1,,,2025-10-16 21:06:47+00:00
Trump Moves to Pay Some ICE and TSA Agents During Shutdown,https://www.nytimes.com/2025/10/16/business/trump-ice-pay.html,-1,,,2025-10-16 22:36:15+00:00
"Listen: Sharing Resources, Best Practices in AI",https://www.insidehighered.com/news/student-success/academic-life/2025/10/17/podcast-san-diego-colleges-create-equitable-ai,-1,,,2025-10-17 00:00:00+00:00
Indiana University Fires Adviser to Student Newspaper and Bars Print Publication,https://www.nytimes.com/2025/10/17/business/media/indiana-university-daily-student-newspaper.html,-1,,,2025-10-17 09:04:05+00:00
Trump Officials Appeal Challenge to Their Efforts to Restrict D.E.I.,https://www.nytimes.com/2025/10/17/us/trump-officials-appeal-challenge-dei-restrictions.html,-1,,,2025-10-17 15:20:01+00:00
White House to Meet College Leaders About Preferential Funding Plan,https://www.bloomberg.com/news/articles/2025-10-17/white-house-to-meet-college-leaders-about-preferential-funding-plan,-1,,,2025-10-17 18:18:18+00:00
Brown University Rejects White House Deal for Special Treatment,https://www.nytimes.com/2025/10/15/us/brown-university-trump-compact-funding.html,-1,,,2025-10-17 18:25:44+00:00
Federal Workers File Most Jobless Claims Since Last Shutdown,https://www.bloomberg.com/news/articles/2025-10-17/federal-workers-file-most-jobless-claims-since-last-shutdown,-1,,,2025-10-17 18:56:19+00:00
Federal courts to shift to limited operations during government shutdown,https://lailluminator.com/2025/10/17/repub/federal-court-shutdown/,-1,,,2025-10-17 19:01:07+00:00
A look at Russell Vought&#8217;s influence and his push to reshape the government,https://www.pbs.org/newshour/show/a-look-at-russell-voughts-influence-and-his-push-to-reshape-the-government,-1,,,2025-10-17 22:35:03+00:00
"National Cybersecurity Awareness Month, 2025",https://www.whitehouse.gov/presidential-actions/2025/10/national-cybersecurity-awareness-month-2025/,-1,,,2025-10-17 23:22:22+00:00
Education Dept. Agrees to Resume More Student Loan Cancellations,https://www.nytimes.com/2025/10/17/business/student-loan-cancellation-idr.html,-1,,,2025-10-18 00:02:13+00:00
Universities Are Standing Up to Trump,https://www.nytimes.com/2025/10/17/us/universities-are-standing-up-to-trump.html,-1,,,2025-10-18 00:58:30+00:00
10 Injured in Balcony Collapse in Cincinnati,https://www.nytimes.com/2025/10/18/us/cincinnati-balcony-collapse.html,-1,,,2025-10-18 11:50:45+00:00
Indiana University and its student paper are at odds on press freedom,https://www.washingtonpost.com/business/2025/10/18/indiana-university-student-newspaper/,-1,,,2025-10-18 12:00:23+00:00
Federal judge broadens order blocking Trump administration layoffs during shutdown,https://lailluminator.com/2025/10/18/repub/layoffs-shutdown-3/,-1,,,2025-10-18 13:57:32+00:00
When could the shutdown end? Five key dates to watch,https://thehill.com/homenews/senate/5561093-shutdown-end-dates-to-watch/,-1,,,2025-10-18 14:00:00+00:00
Los Angeles declares emergency over ICE raids as tensions escalate 10/18/2025,https://www.alipac.us/f9/los-angeles-declares-emergency-over-ice-raids-tensions-escalate-10-18-2025-a-434107/,-1,,,2025-10-18 17:47:00+00:00
NRSC uses AI video of Schumer to slam Dems over shutdown,https://thehill.com/homenews/senate/5562127-ai-generated-schumer-shutdown-video/,-1,,,2025-10-18 23:21:06+00:00
Trump steamrolls GOP Congress during shutdown to implement agenda,https://thehill.com/homenews/administration/5561218-trump-sidelines-congress-shutdown/,-1,,,2025-10-19 10:00:00+00:00
"ACEx2026 to Feature State of Higher Education Address, Sessions Around Pressing Topics",https://www.acenet.edu/News-Room/Pages/ACEx2026-Sessions-Pressing-Topics.aspx,-1,,,2025-10-20 00:00:00+00:00
ACE Announces Three-Part Webinar Series on Advancing Military Learner Success,https://www.acenet.edu/News-Room/Pages/Military-Learner-Success-Series.aspx,-1,,,2025-10-20 00:00:00+00:00
"Canvas, Snapchat work to restore service after Amazon Web Services outage • The Tulane Hullabaloo",https://tulanehullabaloo.com/71386/news/canvas-snapchat-work-to-restore-service-after-amazon-web-services-outage/,-1,,,2025-10-20 00:00:00+00:00
Can a University From Tennessee Help Accelerate Growth in West Palm Beach?,https://www.nytimes.com/2025/10/19/business/vanderbilt-university-expansion.html,-1,,,2025-10-20 02:10:55+00:00
Why Are More Retirees Going Back to College?,https://www.nytimes.com/2025/10/20/realestate/why-are-more-retirees-going-back-to-college.html,-1,,,2025-10-20 09:00:09+00:00
How is this shutdown different from other shutdowns?,https://www.washingtonpost.com/business/2025/10/20/government-shutdown-trump-administration/,-1,,,2025-10-20 10:00:00+00:00
"Watch live: Johnson, Republicans address reporters on shutdown's 20th day",https://thehill.com/homenews/house/5563178-watch-live-mike-johnson-republicans-shutdown/,-1,,,2025-10-20 13:00:00+00:00
Chip Roy says Democratic Party taking its 'dying breaths',https://www.foxnews.com/politics/chip-roy-says-democratic-party-taking-its-dying-breaths,-1,,,2025-10-20 16:38:31+00:00
Republicans broach a longer stopgap bill as shutdown enters fourth week,https://www.politico.com/news/2025/10/20/government-shutdown-gop-cr-date-00616040,-1,,,2025-10-20 19:12:03+00:00
Thune: Time to think about House returning to DC to vote on government funding,https://thehill.com/homenews/senate/5563802-thune-house-dc-government-funding-shutdown/,-1,,,2025-10-20 20:02:13+00:00
"WATCH: 'No Kings' protester steps up to mic and calls for ICE agents to be 'shot,' 'wiped out'",https://www.foxnews.com/politics/watch-no-kings-protester-steps-up-mic-calls-ice-agents-shot-wiped-out,-1,,,2025-10-20 20:57:31+00:00
LSU presidential search committee members required to sign non-disclosure agreements,https://lailluminator.com/2025/10/20/lsu-presidential-search-committee-members-required-to-sign-non-disclosure-agreements/,-1,,,2025-10-20 21:10:58+00:00
Sen. Ted Cruz Says the US Shutdown 'Needs to End Now',https://www.bloomberg.com/news/videos/2025-10-20/sen-ted-cruz-says-the-us-shutdown-needs-to-end-now-video,-1,,,2025-10-20 21:16:11+00:00
Universities give cold shoulder to Trump compact offer,https://thehill.com/homenews/education/5563651-trump-college-pact-deadline-mit-uva-brown/,-1,,,2025-10-20 21:36:53+00:00
"Bloomberg Talks: Colin Allred Talks No Kings, Shutdown (Podcast)",https://www.bloomberg.com/news/audio/2025-10-20/bloomberg-talks-colin-allred-talks-no-kings-shutdown-podcast,-1,,,2025-10-20 22:20:06+00:00
"Live update: Democrats block funding bill for 11th time, with no end to shutdown in sight",https://thehill.com/homenews/administration/5561233-live-updates-trump-government-shutdown/,-1,,,2025-10-20 22:23:32+00:00
Senate Dems emboldened by weekend rallies block GOP plan to end shutdown for 11th time,https://www.foxnews.com/politics/senate-dems-emboldened-weekend-rallies-block-gop-plan-end-shutdown-11th-time,-1,,,2025-10-20 22:23:44+00:00
Democrats block bill to end government shutdown for 11th time,https://thehill.com/homenews/senate/5564176-government-shutdown-vote-senate/,-1,,,2025-10-20 22:25:25+00:00
Research: Can VR Teach Students Ethics?,https://www.insidehighered.com/news/student-success/academic-life/2025/10/21/research-can-vr-teach-students-ethics,-1,,,2025-10-21 00:00:00+00:00
All but 2 Universities Decline a Trump Offer of Preferential Funding,https://www.nytimes.com/2025/10/20/us/politics/universities-funding-compact.html,-1,,,2025-10-21 01:16:30+00:00
Man who admitted college campus sexual assault to victim in a Facebook message sentenced to prison,https://www.cbc.ca/news/world/us-gettysburg-sexual-assault-facebook-europe-case-9.6946467?cmp=rss,-1,,,2025-10-21 06:37:20+00:00
How a Long Government Shutdown Could Leave Scars on the Economy,https://www.nytimes.com/2025/10/21/business/economy/government-shutdown-economic-effects.html,-1,,,2025-10-21 09:02:23+00:00
"Flight delays, cancellations increase shutdown pressure on lawmakers",https://thehill.com/regulation/transportation/5564446-flight-delays-cancellations-shutdown-pressure/,-1,,,2025-10-21 10:00:00+00:00
Trump approval ticks up despite GOP shutdown blame: Survey,https://thehill.com/homenews/administration/5564740-trump-approval-rating-up-gop-shutdown/,-1,,,2025-10-21 12:03:28+00:00
"Trump says Schumer, Senate Democrats holding government 'hostage' with shutdown: 'We will not be extorted'",https://www.foxnews.com/politics/trump-says-schumer-senate-democrats-holding-government-hostage-shutdown-we-will-not-be-extorted,-1,,,2025-10-21 18:33:04+00:00
"The longest government shutdowns in US history, ranked",https://www.businessinsider.com/longest-us-government-shutdowns-ranked,-1,,,2025-10-21 18:33:47+00:00
The Costs of Protecting Campus Speech,https://www.nytimes.com/2025/10/21/opinion/campus-speech-costs.html,-1,,,2025-10-21 20:07:29+00:00
Trump Officials Move Toward Deal With University of Virginia After Standoff,https://www.nytimes.com/2025/10/21/us/politics/trump-virginia-university.html,-1,,,2025-10-21 20:10:51+00:00
Undercover video reveals red state university employee suggesting DEI is simply being rebranded,https://www.foxnews.com/politics/undercover-video-reveals-red-state-university-employee-suggesting-dei-simply-being-rebranded,-1,,,2025-10-21 21:23:02+00:00
Advocates cheer as Trump admin agrees to student loan forgiveness deal,https://thehill.com/homenews/education/5566117-trump-student-loan-forgiveness-deal-debt-relief/,-1,,,2025-10-21 22:05:20+00:00
"College Grads, Some Workers in US Spared New $100,000 H-1B Fee",https://www.bloomberg.com/news/articles/2025-10-21/college-grads-some-workers-in-us-spared-new-100-000-h-1b-fee,-1,,,2025-10-21 22:33:54+00:00
Another university declines Trump&#8217;s offer for priority funding,https://www.pbs.org/newshour/show/another-university-declines-trumps-offer-for-priority-funding,-1,,,2025-10-21 22:40:20+00:00
Trump on US Shutdown: 'Let the Country Open',https://www.bloomberg.com/news/videos/2025-10-21/trump-on-us-shutdown-let-the-country-open,-1,,,2025-10-21 22:46:28+00:00
One stopgap after another: Shutdown puts Congress on the verge of failed spending process,https://lailluminator.com/2025/10/21/repub/shutdown-congress-3/,-1,,,2025-10-21 23:18:53+00:00
Harvard Slashes Admissions for Ph.D. Candidates,https://www.insidehighered.com/news/quick-takes/2025/10/22/harvard-slashes-admissions-phd-candidates,-1,,,2025-10-22 00:00:00+00:00
Trump is creating two classes of federal workers: Paid and unpaid,https://www.washingtonpost.com/business/2025/10/22/trump-shutdown-federal-workers-pay/,-1,,,2025-10-22 09:00:00+00:00
Bird Flu Is Back,https://www.nytimes.com/2025/10/22/health/h5n1-bird-flu.html,-1,,,2025-10-22 09:02:03+00:00
Number of young adults identifying as transgender plunges by nearly half in two years,https://www.foxnews.com/health/number-young-adults-identifying-transgender-plunges-nearly-half-two-years,-1,,,2025-10-22 11:00:36+00:00
Colleges Face a Reckoning: Is a Degree Really Necessary?,https://www.nytimes.com/2025/10/22/us/value-of-higher-education-attainment-rates-graduation.html,-1,,,2025-10-22 11:02:21+00:00
Walmart pauses hiring candidates who need H-1B visa after Trump hikes fee,https://thehill.com/business/5566965-walmart-h-1b-visa-trump/,-1,,,2025-10-22 13:43:19+00:00
"US Considers Broad Software Curbs on China, White House Says",https://www.bloomberg.com/news/articles/2025-10-22/us-considers-broad-software-curbs-on-china-reuters-reports,-1,,,2025-10-22 17:28:28+00:00
University of Virginia strikes deal with Justice Department to pause civil rights investigations,https://abcnews.go.com/US/wireStory/university-virginia-strikes-deal-justice-department-pause-civil-126772821,-1,,,2025-10-22 20:29:45+00:00
"Anti-Union, Pro-Israel Billionaires Are Behind Tim Walberg and His Show Trials",https://truthout.org/articles/anti-union-pro-israel-billionaires-are-behind-tim-walberg-and-his-show-trials/,-1,,,2025-10-22 20:54:59+00:00
Americans turning more negative on Congress: Gallup,https://thehill.com/homenews/senate/5568059-congress-approval-rating-decline/,-1,,,2025-10-22 21:10:37+00:00
"Shutdown reaches day 22, second-longest in US history with no sign of a deal",https://lailluminator.com/2025/10/22/repub/shutdown-day-22/,-1,,,2025-10-22 21:55:21+00:00
Schumer blocks 12th GOP bid to reopen government as Trump says Democrats 'lost the negotiation',https://www.foxnews.com/politics/schumer-blocks-12th-gop-bid-reopen-government-trump-says-democrats-lost-negotiation,-1,,,2025-10-22 21:56:05+00:00
Democrats block government funding bill for 12th time after marathon floor protest,https://thehill.com/homenews/senate/5568368-democrats-government-funding-bill-shutdown/,-1,,,2025-10-22 21:59:07+00:00
The rise of viral debate videos and their impact on our ability to disagree,https://www.pbs.org/newshour/show/the-rise-of-viral-debate-videos-and-their-impact-on-our-ability-to-disagree,-1,,,2025-10-22 22:30:41+00:00
Live updates: Senate's 12th attempt to end shutdown fails; final NYC mayoral debate kicks off,https://thehill.com/homenews/administration/5566175-live-updates-trump-government-shutdown/,-1,,,2025-10-22 23:02:33+00:00
"Merkley nearly breaks Booker's filibuster record, wins his praise for fighting 'Trump's authoritarian tactics'",https://www.foxnews.com/politics/merkley-nearly-breaks-bookers-filibuster-record-wins-his-praise-fighting-trumps-authoritarian-tactics,-1,,,2025-10-22 23:56:28+00:00
University of Virginia Makes Deal With White House to Halt Investigations,https://www.nytimes.com/2025/10/22/us/politics/university-of-virginia-trump-agreement.html,-1,,,2025-10-23 01:45:56+00:00
Government shutdown knowledge: gaming out its potential end,https://www.foxnews.com/politics/government-shutdown-knowledge-gaming-out-its-potential-end,-1,,,2025-10-23 04:00:23+00:00
Financial Assistance Options for Federal Employees During the Government Shutdown,https://www.nytimes.com/2025/10/23/business/federal-employee-financial-resources-government-shutdown.html,-1,,,2025-10-23 09:02:04+00:00
"A $20,000 Football Suite With Luxe Food Is Latest Money Machine for Colleges",https://www.bloomberg.com/news/features/2025-10-23/college-football-stadiums-add-fine-dining-as-schools-chase-revenue,-1,,,2025-10-23 12:00:12+00:00
Harvard Records an Increase in Asian Students and a Drop in Black Students,https://www.nytimes.com/2025/10/23/us/harvard-admissions-data-black-asian-latino-students.html,-1,,,2025-10-23 13:19:41+00:00
